Individual,General,Clay Shirky,Clay Shirky,"Shanghai, China; New York, NY",http://www.shirky.com,null,null,@cshirky,311053,NYU Interactive Telecommunications Program; Berkman Center for Internet and Society;Personal Democracy Media,null,null,null,null,null,null,null,null,null,null,1
Non-Profit,21st Century Jobs and Opportunities,World Business Chicago,World Business Chicago,"Chicago, IL",www.worldbusinesschicago.com,32,"Jeff Malehorn, Carolyn Phillips, John Ramirez, Philip Nevels, Rahm Emanuel",@worldbizchicago,5639,null,Chicago Mayor's Office,Chicago Mayor's Office; Chicago Department of Business Affairs and Consumer Protection; Department of Commerce and Economic Opportunity; Chicago Sister Cities International,null,null,null,null,Revenue:22634995; Expenses:25182263,2012,Chicago Career Tech Skills for Chicagoland's Future:1546231,2012,0
Non-Profit,21st Century Jobs and Opportunities,Chicago Innovation Exchange,Chicago Innovation Exchange,"Chicago, IL",https://cie.uchicago.edu/,null,"John Flavin, Jason Pariso, Kristin Barret, Tom Ancona, Nikki Kidd, Wendy Jones, Wolfgan Connell",@ChicagoCIE,663,null,University of Chicago,Polsky Center for Entrepreneurship and Innovation; UChicagoTech; Argonne National Laboratory; Booth School of Business; UChicago Office of Civic Engagement; University of Chicago College; The Computation Institute; UChicago Division of Biological Sciences; UChicago Division of the Physical Sciences; Fermi National Accelerator Laboratory; Institute of Molecular Engineering; UChicago Institute of Politics; Institute for Translational Medicine; Marine Biological Laboratory; University of Chicago Medicine; University of Chicago Law School; Urban Education Institute,Cisco Entrepreneurs in Residence:null,null,null,null,null,null,"Reflexion Pharmaceuticals:75000; Ice Slurry Refrigerant:100000; Nano-Filter Desalination:65000; PhysIQ:75000; Text Filters:55000; AgileMD:50000; Interferon-Related DNA Damage Resistance Signature (IRDS):50000; TAT-MLL:50000; Anti-ADAM10 Monoclonal Antibody for Treating Skin and Lung Infections:50000; Anti-Protein A Monoclonal Antibody for the Prevention of Straphylococcal Bacteremia:50000; Compounds for the Potentiations of Antibiotic Sensitivity in MRSA:100000; IGF-1 for the Treatment of Recurrent Migraine:100000; Companion Diagnostic for Incretin-Based Therapies:100000; Senescent Cell Cancer Vaccine:60000; System for Clinical Trial Protocol Generation and Management:40000; Antibody-Targeted LIGHT for the Treatment of Primary Tumors and Metastatic Disease in Cancer:100000; Nanocyrstal ""Glue"" for High-Efficiency Thermoelectric Materials:100000; Small Molecule Inhibitors of Copper Chaperones for the Treatment of Cancer:80000; Testing New Venues for Pritzker Course Content Transformation, Distribution, and Commercialization:20000; Ci3's Game Changer Chicago (GCC) Design Lab:50000; ExplORer Surgical Information System:64300; Genomic Prescribing System (GPS):100000; Nanoscale Coordination Polymers (NCP) for Platinum-Resistant Ovarian Cancer:100000; Companion Diagnostic for Treatment of Estrogen Receptor Negative Breast Cancer:55000; Easy-to-Use High-Fidelity Hydrodynamic Simulation Software Package for Development of New Light-Source Technologies:50000; Quantitative Insights Inc:150000; Simplified Chromatin Conformation Capture:70000",2014,0
Non-Profit,21st Century Jobs and Opportunities,1871,1871,"Chicago, IL",http://1871.com,null,"George Vukotich, Melissa Wooten, Laura Fendrich, Rhonda Fair, Sara Clay, Diana Lopez-Obaldo, Laura Clark, Deena Siegal, Howard Tullman, Tom Alexander, Kristi Dula, Josie Pike, Abbie Torgeson, Jasmine Slivka",@1871Chicago,22570,null,"Chicagoland Entrepreneurial Center, Urban Center for Computation and Data",University of Illinois Urbana-Champagne; Chicago; Springfield; Origin Venture; Booth School of Business; Starter League; Tech Stars; Sandbox Industries; Northwestern University; Pritzker Group:Venture Capital; The Impact Engine; Illinois Science and Technology Coalition; Illinois Institute of Technology; Chicago Ventures; Urban Center for Computation and Data,CDW:null; Chase Bank:null; Cisco Systems Inc:null; Comcast:null; DCEO:null; Ernst & Young:null; State of Illinois:null; Motorola Mobility Foundation:null; Netrix LLC:null; Google:null; The Brinson Foundation:null; Katten Muchin Rosenman LLP:null; KPMG:null; Microsoft:null; World Business Chicago:null; DeVry:null; Illinois Math and Science Academy:null; Lightbank:null; OCA Ventures:null; Regus:null; Studley:null; TriNet:null; Crain's:null; Sure Payroll:null; Chicago Innovation Awards:null,2014,null,null,Revenue:3886501; Expenses:1851281,null,null,null,0
Non-Profit,21st Century Jobs and Opportunities,Blue 1647,Blue 1647,"Chicago, IL",http://www.blue1647.com/,null,"Emile Cambry Jr., Antonio Rowry, Jerome Dishman, Ray Lambert, George Geiger, Jonathan Paul Cambry",@BLUE1647,800,null,null,Chicago Mayor's Office,21st Century Youth Project:null; Chicago International Social Change Film Festival:null; Code Chicago:null; Chicago Inventors Organization:null; United NFC:null; Left for Good:null; SponsorChange:null; MEDTOON:null; Reel Illinois:null; YuuConnect:null; Impakt Studio:null; Inclusive Community Project:null; American Chamber Opera Company:null; Politica Aberta:null; Project Exploration:null; Foodhe.ro:null; iMagine It Tech:null; Fluidity Community and Political Consulting:null; Chase Charles Studio:null; Benefit Management Associates:null; The Michael Logic Administration:null; Rigo Ramirez:null; Chicago Comedy Film Festival:null; Hands on Training:null; Dreamz and Visionz:null; Lake Street Barbering Co.:null; Expo Collective:null; Ms Tech:null; Baby Truths:null; Rivive Group:null; PyroPhase:null; Lightning Smart:null; Open Source Temple:null; Parent Power Chicago:null; Urban Leash:null,null,null,null,null,null,null,null,0
Non-Profit,Data and Transparency,Data Science for Social Good,Data Science for Social Good,"Chicago, IL",http://dssg.io/,null,"Rayid Ghani, Matt Gee, Tom Plagge, Andrew Means, Kate Kusiak Galvin, Rob Mitchum, Eric Schmidt, Ian Foster, Charlie Catlett",@datascifellows,2645,null,University of Chicago,Microsoft Corporation; Google,Eric Schmidt: null,null,null,null,null,null,null,null,1
Non-Profit,Data and Transparency,Urban Center for Computation and Data,Urban Ctr for Computation and Data,"Chicago, IL",http://urbanccd.org,null,"Charlie Catlett, Rayid Ghani, Ian Foster, Brett Goldstein, Kathleen Cagney, Stay Lindau, Robert M. Goerge, Robert Rosner, Keith Besserud, Jim Sallee, James Evans, Mario Luis Smal, Doug Pancoast, Svetlozar Nestorov, Doug Voigt, Bo Rodda, Matt Gee",@UrbanCCD,445,null,University of Chicago,National Science Foundation; Skidmore; Owings; & Merrill; School of the Art Institute of Chicago; Chapin Hill; South Side Health and Vitality Studies; Population Research Center; UChicago Research Computing Center; Energy Policy Institute at Chicago; John D. and Catherine T. MacArthur Foundation; City of Chicago; Computation Institute; Argonne National Laboratory; 1871,null,null,null,null,null,null,null,null,0
Non-Profit,Smart and Resilient Cities,UI LABS,UI LABS,"Chicago, IL",http://www.uilabs.org/,null,null,@UILABS_,894,null,null,Digital Manufacturing and Design Innovative Institute; University of Illinois,Department of Defense:70000000; null:250000000,2014,null,null,null,null,null,null,0
Non-Profit,Smart and Resilient Cities,Local Initiatives Support Corporation,LISC,"Chicago, IL",http://lisc.org,null,"Susana Vasquez, Jake Ament, Dionne Baux, Barbara Beck, Keri Blackwell, Monita Blunt, Chris Brown, Julia Chillers, Caroline Goldstein, Ricki Granetz Lowitz, Maria Hernandez, Clarence Hogan, Jennifer McClain, Taryn Roch, Alba Santillan, Dominique Williams ",@LISCChicago,1007,null,null,Neighborhood Lead Agencies; Centers for Working Families; Elev8 Schools,null,null,null,null,null,null,null:7230000,2013,0
Non-Profit,21st Century Jobs and Opportunities,Chicagoland Chamber of Commerce,Chicagoland Chamber of Commerce,"Chicago, IL",http://www.chicagolandchamber.org/wdk_cc/,48,"Theresa Mintle, John Carpenter, Peggy Luce, Maria Rodriguez, Dana Snodgrass",@ChicagolandCmbr,7453,null,"Chicagoland Chamber of Commerce Political Action Committee, Chicagoland Chamber of Commerce Foundation",Metropolitan Administrative Services,null,null,null,null,Revenue:5442744;Expenses:5373241,2012,null,null,0
Non-Profit,Data and Transparency,Chicago Data Visualization User Group,Chicago Data Viz User Group,"Chicago, IL",http://chicagodataviz.wordpress.com/,null,Tom Schenk,@ChicagoDataVis,182,null,null,Chicago Mayor's Office; Chicago Sister Cities International,null,null,null,null,null,null,null,null,0
Non-Profit,Data and Transparency,Chicago Open Data Institute,Chicago Open Data Institute,"Chicago, IL",http://odichicago.org/#,null,"Paul Baker, Forest Gregg, Nick Rougeux, Bilyan Belchev, Elnaz Moshfeghian, Anna Marie Tamayo, Patrick Barry",@DataInstitute,451,null,Open Data Institute,California Sentencing Institute; SchoolCuts; OpenCity,null,null,null,null,null,null,null,null,0
Non-Profit,Data and Transparency,City Data User Group,City Data User Group,"Chicago, IL",http://www.meetup.com/ChicagoCityData/,null,Adam Hecktman,@ChicagoCityData,97,null,null,Microsoft Corporation; Chicago Mayor's Office,null,null,null,null,null,null,null,null,0
Non-Profit,21st Century Jobs and Opportunities,Year Up,Year Up,"Boston, MA",http://www.yearup.org/,null,"Gerald Chertavian, Garrett Moran, Noel Anderson, Jeff Artis, Timothy Higdon, Shawn Jacqueline Bohen, Scott Donahue, Sandra Stark, Sue Meehan",@YearUp,6548,null,null,501cTECH; Aarons Rents; AARP; Accenture; Achieving the Dream; Advent International; Aerotek; AGL Resources; Akin Gump Strauss Hauer & Feld; Alameda Health System; Allegis Group; AllianceBernstein L.P.; Amdocs; American Airlines; American Cancer Society; American Express; American Sugar Refining Inc.; Amica; Ann Inc.; AnyBill; AOL; AOL Advertising; AON; Apptio; Arbitron; ASIS International; Athenahealth; Atrius Health; Autodesk; AutoTrader; AvalonBay Communities; Avectra; Bain Capital LLC; Baltimore City; Baltimore City Community College; Bank of the West; Baptist Health South Florida; Baupost Group L.L.C.; Baxter Healthcare; Bay Area Video Coalition; Beacon Mutual; Bellevue College; BET Networks; Big Fish Games; Bill and Melinda Gates Foundation; Biogen Idec; Blackboard; Blackstone; Bloomberg LP; Blue Cross Blue Shield of Rhode Island; Blue Shield of California; Boston Arts Academy; Boston Childrens Hospital; Boston Financial Data Services; Boston Medical Center; Boston Scholar Athletes; Bright Horizons Family Solutions; Brookings Institution; Brooks Sports; Brown University; Cabot Corporation; Capital One; Care New England; CARE USA; Careerbuilder; Carefirst Blue Cross Blue Shield; Carlyle Group; Carters; Catapult Technology; Cbeyond; CDW; Center for American Progress; CGI; Charles Schwab; Citadel Investment Group; Citi; Citizen Schools; Citizens Bank; Clearwire; CME Group; CohnReznick; Colonial Pipeline; Commonground Marketing; Computers For Youth; Concurix; Cook County; Covidien Latin America; Credit Suisse; CRICO/RMF; Custom Ink; Dashwire; Daughters of Charity Health System; Dell Secureworks; Dell Systems; Deloitte LLP; Deltek; Deutsche Bank; DHL Express Americas; Dickstein Shapiro; Digital Harbor Foundation; DocuSign; Dow Lohnes; Dreambox; DRW Trading Group; Dunkin Brands; Dunn Lumber; Eastern Bank; Eaton Vance Management; eBay; Elavon; Electronic Arts; Embrace Home Loans; Emerging Health Information Technology; Ernst and Young; Exelon; F5 Networks Inc; Fannie Mae; FBR Capital Markets; Federal Home Loan Bank Seattle; Federal Reserve Bank Chicago; Federal Reserve Bank of Atlanta; Federal Reserve Bank of Richmond; FINRA; FM Global; Food & Water Watch; Fred Hutchinson Cancer Research Center; Freddie Mac; FTI Consulting; Gap; Gas South; GE Capital; GE Energy; Genuine Parts Company; George Washington University; Georgia-Pacific; Gilbane; Goizueta Business School; Graduate Management Admission Council; Grantham Mayo Van Otterloo & Co. LLC; Greeley and Hansen; Green Job Works; GTECH; GXS; Haemonetics; Harbor Bank; Harvard University; Hearst Ventures; Hewlett Packard; Hilton Worldwide; Hogan Lovells; Holder Construction; Honey Shines Mentoring Program; Horsetail Technologies; Huron Consulting Group; IDG; In-Q-Tel; Income Research + Management; Incomm; Infinera; ING Group; Intercontinental Exchange; Intercontinental Hotels Group; Itineris; Jawbone; John Hancock; Johns Hopkins Medicine; Johns Hopkins University; Jumpstart; Kaplan University; kCura; Kixeye; Lasership; Latham & Watkins LLP; Lifespan; LinkedIn; Lynn Community Health Center; M. Block and Sons Inc; Manheim Auctions; Marin General Hospital; Marketo; Marsh USA; Meeting Tomorrow; Memorial Healthcare System; Memorial Sloan-Kettering Cancer Center; MFS Investment Management; MHCDO; Microsoft Corporation; Millennial Media; MIT; Morningstar Inc.; Motley Fool; Mount Sinai Medical Center; Mozilla; Muse Technologies; Museum of Fine Arts; NASA; National Aquarium; National Society of Black Engineers; NetApp; Network Health; Neustar; New Signature; New York City Department of Youth and; Community Development; New York Life Retirement Plan Services; New York Presbyterian; New York University; Newell Rubbermaid; Nintendo of America; Nordstrom; North Highland; North Shore LIJ; Northern Virginia Community College; Open Arms; Oracle; Outerwall; Pacific Medical Centers; Partners HealthCare; Passport Capital; Patton Boggs; Pegasystems Inc.; Pepco Holdings Inc; Perkins Coie LLP; PGI Alliance; Pioneer Investments; Premera; Prince Georges Community College; Printpack Inc.; Quality Technology Services; Rainbow PUSH Coalition; Randstad; Redbox; Regence Blue Shield; RetailNext; 2013 Year Up Annual Report 29; Rimm Kaufman; Robert F. Kennedy Center for Justice & Human Rights; Robert Half International; RockTenn; Rollins; RPC Inc.; Rush Univ Medical Center; Russell; SAIC; Saunders Hotel Group LLC; Seattle Cancer Care Alliance; Seattle Childrens Hospital; Serta Simmons; Service Benefit Plan Administrative Services Corporation; Shire Human Genetic Therapies; Sidley Austin LLP; Simulia; Sothebys; Southern Company; Southpoint Consulting; Splash Worldwide; Splunk; Starwood Capital Group; State Street; Steward Health Care System; SunRun; Sutter Health - California Pacific Medical Center; Swarovski; Swedish Medical Center; T-Mobile; T. Rowe Price; Tech Mahindra; Teen Force; Textron; The Coca-Cola Company; The Family League of Baltimore; The Huffington Post; The LAB Miami; The Leona M. and Harry B. Helmsley Charitable Trust; The Miami Herald; The Weather Company; Time Warner Inc.; Travelport; Treasury Wine Estates; Tribeca Flashpoint; Tufts Medical Center; Twitter; UMass Boston; University of Maryland Medical System; US Department of Commerce; Vanguard Health Systems; Ventas Inc.; Vertafore; Verve; Vocalocity; Washington Federal; Weil Gotshal & Manges; Wellington Management Company; Wells Fargo; WGL Holdings Inc.; Wheels Inc.; WhitePages; Whittier Street Health Center; Williams & Connolly; Workday; World Fuel Services; Yelp; Zynga,Bank of the West:null; Barclays Capital:null; Baupost Group LLC:null; Boeing Company:null; JP Morgan Chase:null; MBlock:null; Microsoft:null; State Street Corporation:null; American Tower Corporation:null; Boston Children's Hospital:null; CA Technologies:null; Corvex Management LP:null; Eaton Vance Management:null; Grosvenor Capital Management L.P.:null; Kaiser Permanente:null; National Cable & Telecommunications Association:null; Northern Trust:null; Pepco Holdings Inc.:null; Swedish Medical Center:null; Tudor Foundation Inc.:null; Two Sigma Investments LLC:null; Accenture:null; Acumen Solutions VA:null; Aerotek:null; Allegis Group:null; athenahealth:null; Avectra:null; Bloomberg LP:null; BNY Mellon:null; Capital Group Companies:null; Charles Rose Architects:null; Covidien:null; Deltek Inc.:null; DRW Trading Group:null; EMC Corporation:null; Genuine Parts Company:null; Goldman Sachs:null; GTECH:null; Hasbro:null; HighBrook Investment Management:null; Income Research + Management:null; New York Life Retirement Plan Services:null; Rabine Group:null; Shire Human Genetic Therapies:null; The Roderick Group:null; W. W. Grainger:null; Wingate Management Company Inc.:null; Atalaya Captal:null; AvalonBay Communities:null; Bessemer Trust Company:null; Boston Trust & Investment Management Company:null; Cassidy Turley:null; Charlesbank Capital Partners:null; CitiGroup:null; Citizens Bank:null; Commonwealth Limousine Worldwide:null; CVS/Caremark:null; Davenport Fund:null; Embassy of the State of Qatar:null; Fiera Capital:null; GitHub:null; HNTB:null; Javlin Capital:null; Jefferies & Company Inc.:null; Kaye-Smith Enterprises:null; KPMG:null; Latham & Watkins LLP:null; Loomis Sayles & Company:null; Manpower:null; Mellon Capital Management:null; NEPC:null; New York Life Insurance Company:null; Nintendo of America:null; Openview Venture Partners:null; Partners HealthCare:null; Pegasystems Inc.:null; Putnam Investments:null; Robert Half International:null; Sidley Austin LLP:null; Society of Information Management - Washington Chapter:null; Southern Company:null; Spectrum Incorporated General Contracting:null; STAG Industrial:null; Standish Investment Management:null; Stop & Shop Supermarkets:null; The Boston Company Asset Management:null; Thomas H. Lee Partners:null; TPG Capital:null; W.B. Mason:null; Wells Fargo Advisors:null; Wells Fargo Bank of Georgia:null; Wight & Company:null; 501cTECH:null; 88 Herido LLC:null; AAA:null; Abbott Klar Real Estate Group:null; Abrams Capital Management LLC:null; Alnor Oil Company:null; Alston & Bird LLP:null; American Association of Community Colleges:null; Anchor Capital:null; Atlanta Metropolitan State College:null; Bank Rhode Island:null; Batterymarch Financial Management:null; BBR Partners:null; Benemax:null; Biogen Idec:null; Blue Cross Blue Shield of Rhode Island:null; Blue State Coffee:null; Boston Financial Data Services:null; Bryant University:null; Carefirst BCBS:null; CBIZ Tofias & Mayer Hoffman McCann P.C.:null; Cisco Systems:null; CME Group:null; CoBank:null; Core-Mark:null; DLA Piper:null; Eliassen Group:null; Embrace Home Loans:null; Eventbrite:null; First Presbyterian Church of New Canaan:null; Foster Pepper PLLC:null; Fulcrum Equity Partners:null; Future State:null; Goodwin Procter LLP:null; Google Matching Gifts Program:null; Google TRIPS for Charity:null; Gourmet Express:null; Grantham Mayo Van Otterloo & Co.:null; HDI - Atlanta:null; HGS Holdings:null; HITT:null; Hogan Lovells:null; Homesite Group Inc.:null; ICF International:null; Jeffries & Company LLC:null; JHL Capital Group:null; John Hancock Financial Services:null; Knight Partners LLC:null; L.K. Bennett:null; Lifespan:null; Lindahl Brothers Inc.:null; MacKay Shields:null; Manulife Financial:null; Mariner Investment Group:null; Mercedes Benz of Silver Spring:null; Meriwest Credit Union:null; MFS Investment Management:null; Morgan Stanley Smith Barney:null; MSCI:null; Navigant Credit Union:null; Neustar:null; Pacific Medical Centers:null; PanAgora Asset Management:null; Permal Group:null; Pioneer Investments:null; POLITE in Public:null; Professional Alternative Inc.:null; Regence Blue Shield:null; Residential Properties Ltd.:null; Richards Barry Joyce & Partners LLC:null; Robeco Investment Management:null; Rollins ITC Operations:null; San Francisco Design Center:null; Seattle Metropolitan Credit Union:null; Simpson Thacher & Bartlett:null; Sovereign Bank:null; Studley:null; Sutter Health - California Pacific Medical Center:null; TechServe Alliance:null; UBS Global Asset Management:null; UBS Investments:null; United Way of National Capital Area:null; Urenco:null; Valassis:null; Wellington Management Company:null; Westfield Capital Management:null; Weston Golf Club:null; WGL Holdings Inc.:null; William Jessup University:null; Ximedica:null; YHB Charitable Endowment:null; Zuma:null,2013,Annie E. Casey Foundation:null; Anonymous:null; AT&T Foundation:null; Bank of America Foundation:null; Barr Foundation:null; Anita & Joshua Bekenstein:null; Kristine & John Bradley:null; Kate & Gerald Chertavian:null; Coatue Foundation:null; Keith Colburn:null; Conard Davis Family Foundation:null; CVS Caremark Charitable Trust:null; Maureen & Timothy Dibble:null; Jane & Peter Drittel:null; Sandy & Paul Edgerley:null; Andrea Feingold:null; Connie & Michael Feldman:null; Elizabeth B. Strickler & Mark Gallogly:null; Bill & Melinda Gates Foundation:null; Greenlight Fund:null; Elizabeth & Phillip Gross:null; Maria & Peter Handrinos:null; Joanna & Jonathon Jacobson:null; The Jenesis Group:null; JPMorgan Chase Foundation:null; The Klarman Family Foundation:null; The Kresge Foundation:null; Laffont Family Foundation:null; Jeannie & Jonathan Lavine:null; Lovett-Woodsum Foundation:null; Mannion Family Foundation:null; Rod McCowan:null; Mary Penniman & Garrett Moran:null; Denise Dupre & Mark Nunnelly:null; Open Society Foundation:null; OXL Foundation:null; Erica & Ted Pappendick:null; Pearson Foundation:null; Pershing Square Foundation:null; Amy & John Phelan:null; The Reeder Foundation:null; Diane Schueneman:null; Gail Snowden:null; The Salem Foundation:null; Jeff Shames:null; Stephanie & Brian Spector:null; The Sternlicht Family Foundation:null; Dr. Melodie Mayberry-Stewart:null; Pam & Alan Trefler:null; Craig Underwood:null; Charlotte & Herbert Wagner III:null; W. Clement & Jessie V. Stone Foundation:null; Tona & Robert White:null,2013,Revenue:70100000; Expenses:57400000,2013,null,null,1
Non-Profit,21st Century Jobs and Opportunities,IC Stars,IC Stars,"Chicago, IL",http://www.icstars.org/,null,"Sandee Kastrul, Carey Kogol, Eric Lannert",@icstarsChicago,2232,null,null,null,CloserLook:null; Comcast:null; Gartner:null; Kraft:null; SalesForce:null; Solstice Mobile:null; TTX:null; Underwriter Laboratories:null,2014,null,null,Revenue:1631856; Expenses:1497176,2013,null,null,0
Non-Profit,Smart and Resilient Cities,Smart Chicago Collaborative,Smart Chicago Collaborative,"Chicago, IL",http://www.smartchicagocollaborative.org/,3,"Daniel O'Neil, Kyla Williams, Sonja Marziano",@SmartChicago,2277,null,null,Chicago Mayor's Office; Chicago Public Schools; Chicago Department of Public Health; Purple Binder; Mikva Challenge; Free Spirit Media; Adler Planetarium; Chicago Community Trust; John D. and Catherine T. MacArthur Foundation; Local Initiatives Support Corporation; Tracklytics; Illinois Science and Technology Coalition,MacArthur Foundation:null; Chicago Community Trust: null; Knight Foundation:null; BTOP PCC:null; Otho S. A. Sprague Memorial Institute:null,2014,null,null,null,null,null,null,0
For-Profit,General,TechNexus,TechNexus,"Chicago, IL",http://www.technexus.com/,null,null,@TechNexus,2565,null,null,PhysIQ; Microsoft Corporation; Center for Neighborhood Technology,null,null,null,null,null,null,null,null,0
Non-Profit,General,Impact Engine,Impact Engine,"Chicago, IL",http://theimpactengine.com/,null,"Dennis Barsema, Linda Darragh, Jessia Droste Yagan, Valerie Hedge, Jamie Jones, Greg Lernihan, Elizabeth Riley, Tasha Seitz, Chuck Templeton",@TheImpactEngine,3751,null,null,null,Freeborn Attorneys at Law:null; Google:null; Hannah's Bretzel:null; Inventables:null; Sram:null; Synergy:null,2014,null,null,null,null,null,null,0
For-Profit,General,Tech Stars,Tech Stars,"Chicago, IL",http://www.techstars.com/,null,"Tony Henikof, Sam Yagan, Nick Rosa, Adam Koopersmith, Steve Farsht",@techstars,129021,null,null,1871,American Airlines:null; DigitalOcean:null; MasterCard:null; Microsoft:null; Cooley:null; SendGrid:null; IBM:null; Silicon Valley Bank:null; Rackspace:null; CDW:null; Verizon:null; AWS Activate:null; Dell:null; Intel:null; Samsung:null; Foley and Lardner LLP:null; TriNet:null,2014,null,null,null,null,null,null,1
Non-Profit,General,Chicagoland Entrepreneurial Center,Chicagoland Entrepreneurial Ctr,"Chicago, IL",http://www.chicagolandec.org/,3,"Jim O'Connor, Kristin Barrett, Kristi Dula, Mike Huffstetler, Melissa Lederer, Josie Pike, Abbie Torgeson",@chicagolandec,5636,null,null,1871,null,null,null,null,Revenue:3886501; Expenses:1851281,2012,null,null,0
For-Profit,General,Founder Institute,Founder Institute,"New York, NY",http://fi.co/#,null,null,@founding,51739,null,null,Microsoft Corporation; AppCampus; Idyllic Software; Palo Alto Software; Crowd Spring; Cloud Elements; Wave Accounting; Softjourn,null,null,null,null,null,null,null,null,1
Non-Profit,Smart and Resilient Cities,Transit Future,Transit Future,"Chicago, IL",http://transitfuture.org/,null,null,@transit_future,313,null,null,Center for Neighborhood Technology; Active Transportation Alliance,Null,null,null,null,null,null,null,null,0
Non-Profit,General,Illinois Technology Association,Illinois Tech Assoc,"Chicago, IL",https://www.illinoistech.org/,null,null,@ITAbuzz,4817,null,null,null,Grant Thornton:null; SouthPoint:null; Liquidus:null; SIM Partners:null; Hireology:null; Entrepreneurs Unplugged:null,null,null,null,null,null,null,null,0
Non-Profit,General,Built in Chicago,Built in Chicago,"Chicago, IL",http://www.builtinchicago.org/,null,"Maria Christopoulos Katris, Adam Calica, Carlin Sack",@BuiltInChicago,18700,null,null,null,null,null,null,null,null,null,null,null,0
Non-Profit,General,Economic Club of Chicago,Economic Club of Chicago,"Chicago, IL",http://www.econclubchi.org/,8,"Donna Zarcone, Kelsey Carlson, Katie Esposito, Cheryl Eugenio, Amy Harris, Erika Jerzy, Andrew Leasure, Megan Nash, Emily Whelchel",@EconClubChi,183,null,null,null,null,null,null,null,Revenue:2824048;Expenses:2430659,2012,null,null,0
